{
  "proposalId": "MIP-21",
  "operationId": "0x1479f0221f839edab5b6bd6509e1d8de7cd01691d05237a1ce45da57ad021396",
  "forkBlock": 42,
  "success": true,
  "gasUsed": 187342,
  "decodedCalls": [
    {
      "index": 0,
      "target": "0x5FC8d32690cc91D4c39d9d3abcBD16989F875707",
      "targetLabel": "MeridianReserve (proxy)",
      "value": "0",
      "selector": "0x4f1ef286",
      "signature": "upgradeToAndCall(address,bytes)",
      "args": [
        {
          "name": "newImplementation",
          "type": "address",
          "value": "0x057ef64E23666F000b34aE31332854aCBd1c8544"
        },
        {
          "name": "data",
          "type": "bytes",
          "value": "0x29b6eca90000000000000000000000009f2c188225babb8ac51c8b49c850678558fefb7b"
        }
      ],
      "innerCalls": [
        {
          "index": 0,
          "target": "0x5FC8d32690cc91D4c39d9d3abcBD16989F875707",
          "targetLabel": "MeridianReserve (proxy, delegatecall into V2)",
          "value": "0",
          "selector": "0x29b6eca9",
          "signature": "initializeV2(address)",
          "args": [
            {
              "name": "operator",
              "type": "address",
              "value": "0x9F2C188225BaBb8aC51c8B49c850678558fEfb7B"
            }
          ]
        }
      ]
    }
  ],
  "changes": [
    {
      "kind": "implementation_changed",
      "contract": "0x5FC8d32690cc91D4c39d9d3abcBD16989F875707",
      "contractLabel": "MeridianReserve",
      "before": "0xDc64a140Aa3E981100a9becA4E685f962f0cF6C9",
      "after": "0x057ef64E23666F000b34aE31332854aCBd1c8544",
      "newCodeHash": "0xd86855a6290a1b2b062adf1bab46d8405480fe65bfddb253c591cafe18b226e1",
      "sourceVerified": false,
      "severity": "medium",
      "description": "Implementation upgraded to 0x057e…8544, deployed by the proposer, source not verified"
    },
    {
      "kind": "selector_added",
      "contract": "0x5FC8d32690cc91D4c39d9d3abcBD16989F875707",
      "contractLabel": "MeridianReserve",
      "selector": "0x0db4818a",
      "signature": "migrateReserves(address)",
      "severity": "high",
      "description": "New external function migrateReserves(address), callable by owner, transfers the full USDC balance to any address"
    },
    {
      "kind": "selector_added",
      "contract": "0x5FC8d32690cc91D4c39d9d3abcBD16989F875707",
      "contractLabel": "MeridianReserve",
      "selector": "0x29b6eca9",
      "signature": "initializeV2(address)",
      "severity": "low",
      "description": "New reinitializer initializeV2(address), executed once by this proposal"
    },
    {
      "kind": "owner_changed",
      "contract": "0x5FC8d32690cc91D4c39d9d3abcBD16989F875707",
      "contractLabel": "MeridianReserve",
      "before": "0x9fE46736679d2D9a65F0992F2272dE9f3c7fa6e0",
      "after": "0x9F2C188225BaBb8aC51c8B49c850678558fEfb7B",
      "severity": "critical",
      "description": "Owner changed from TimelockController to 0x9F2C…fb7B (alt wallet, not the DAO)"
    },
    {
      "kind": "approval_changed",
      "contract": "0x5FbDB2315678afecb367f032d93F642f64180aa3",
      "contractLabel": "MockUSDC",
      "tokenSymbol": "USDC",
      "owner": "0x5FC8d32690cc91D4c39d9d3abcBD16989F875707",
      "spender": "0x9F2C188225BaBb8aC51c8B49c850678558fEfb7B",
      "before": "0",
      "after": "115792089237316195423570985008687907853269984665640564039457584007913129639935",
      "unlimited": true,
      "severity": "critical",
      "description": "MeridianReserve granted 0x9F2C…fb7B an unlimited USDC allowance"
    }
  ],
  "gasBenchmarks": [
    {
      "contract": "0x5FC8d32690cc91D4c39d9d3abcBD16989F875707",
      "contractLabel": "MeridianReserve",
      "signature": "deposit(uint256)",
      "before": 48712,
      "after": 48390
    },
    {
      "contract": "0x5FC8d32690cc91D4c39d9d3abcBD16989F875707",
      "contractLabel": "MeridianReserve",
      "signature": "withdraw(uint256)",
      "before": 53104,
      "after": 52877
    }
  ],
  "simulatedAt": "2026-10-25T09:12:31Z"
}
